{
	"schema": 1,
	"security": 2,
	"grid": 6,
	"buffer": 6,
	"seconds": 50,
	"daemons_min": 1,
	"daemons_max": 3,
	"firewall": [
		{
			"grid_add": 1,
			"buffer_add": 0,
			"seconds_add": -5,
			"daemons_add": 0
		},
		{
			"grid_add": 1,
			"buffer_add": -1,
			"seconds_add": -10,
			"daemons_add": 0
		},
		{
			"grid_add": 1,
			"buffer_add": -1,
			"seconds_add": -15,
			"daemons_add": 0
		}
	]
}
